product_name,title,stars,body
Echo Dot (3rd Gen) – New and improved smart speaker with Alexa (Black),Great buy,5.0,Value for money. Happy with Alexa and the smart bulb.
Echo Dot (3rd Gen) – New and improved smart speaker with Alexa (Black),Best product in this price,5.0,Wooweee now my home is smarter. I can control everything from Dubai.
Echo Dot (3rd Gen) – New and improved smart speaker with Alexa (Black),Superb alexa,5.0,"Alexa voice is awsm really its feeling awsm to talk with alexa.Grt purchase ,if wnybody want to buy a smart speaker go blindly to choose this grt one..."
Echo Dot (3rd Gen) – New and improved smart speaker with Alexa (Black),Excellent product,5.0,Smart home products for those who don't have type the command
Echo Dot (3rd Gen) – New and improved smart speaker with Alexa (Black),Value of money,5.0,Valuable product thanks Amazon Alexa good product
Echo Dot (3rd Gen) – New and improved smart speaker with Alexa (Black),Having trouble using this.,3.0,"I am unable to use Alexa, getting announcement as ""SORRY I AM HAVING TROUBLE UNDERSTANDING RIGHT NOW,  PLEASE TRY AGAIN LATER"". what shall I do. I am using Redmi note 5. When ever I say Alexa then it is giving above announcement.  Some one please help."
Echo Dot (3rd Gen) – New and improved smart speaker with Alexa (Black),A very smart speaker,4.0,Look wise it was good and the sound quality was also good but there are some problems like you can't use another device's hot-spot . You only use first paired wifi. Overall i will give 4 out of 5 star
Echo Dot (3rd Gen) – New and improved smart speaker with Alexa (Black),good product,5.0,good product
Echo Dot (3rd Gen) – New and improved smart speaker with Alexa (Black),A smart speaker that is not so smart,3.0,The speaker as they claim is not that smart. It doesn't understand even the simplest of things on first attempt. Sound quality is good.
Echo Dot (3rd Gen) – New and improved smart speaker with Alexa (Black),Dumber than Google Assistant but Works nicely within Amazon ecosystem.,4.0,Sound quality and voice recognition are good not the best. Dumber than Google Assistant. Works nicely within Amazon ecosystem. Lag in Bluetooth audio output. Need to get smarter. No ability for continued conversation.
Echo Dot (3rd Gen) – New and improved smart speaker with Alexa (Black),Awesome,5.0,"I Get This at 1137rs awesome at this price segment, my favorite alexa😍"
Echo Dot (3rd Gen) – New and improved smart speaker with Alexa (Black),Alexa is amazing,3.0,Make a update to alexa to speak in tamil
Echo Dot (3rd Gen) – New and improved smart speaker with Alexa (Black),Worst product,1.0,Worst
Echo Dot (3rd Gen) – New and improved smart speaker with Alexa (Black),Good,5.0,Good
Echo Dot (3rd Gen) – New and improved smart speaker with Alexa (Black),Alexa Thanks For Joining My Life,5.0,It's The Bang Bang Product Hats Off To The Technology
Echo Dot (3rd Gen) – New and improved smart speaker with Alexa (Black),Amazing,5.0,"It's amazing. It is very good for entertainment and fun purposes also. It can be a nice voice assistant, better than google home mini. I can also control this through my phone."
Echo Dot (3rd Gen) – New and improved smart speaker with Alexa (Black),Best smart speaker at this price range,5.0,Voice recognition is at par with the competition.Compatible with many a languages.Crisp sound quality.Made for all age groups.
Echo Dot (3rd Gen) – New and improved smart speaker with Alexa (Black),"Its really good l,",5.0,"Its really good, go for it"
Echo Dot (3rd Gen) – New and improved smart speaker with Alexa (Black),Don't buy,1.0,Don't buy this product this is very difficult to connect with wifi but sound quality is very good
Echo Dot (3rd Gen) – New and improved smart speaker with Alexa (Black),Nice product,5.0,Alexa is superb piece of technology. But need to improve the quality of the product.
Echo Dot (3rd Gen) – New and improved smart speaker with Alexa (Black),Loving it..,5.0,It's fun to have Alexa at home..
Echo Dot (3rd Gen) – New and improved smart speaker with Alexa (Black),Great,5.0,Good
Echo Dot (3rd Gen) – New and improved smart speaker with Alexa (Black),This is made in china prodct,1.0,Country of origin was missing when ordered. Returned because of made in china product.
Echo Dot (3rd Gen) – New and improved smart speaker with Alexa (Black),Good product,5.0,Good product must have
Echo Dot (3rd Gen) – New and improved smart speaker with Alexa (Black),Check your network.,5.0,Everything is perfect.. If you are going to purchase it.. Please check your mobile network first... It only works with the help of network...
Echo Dot (3rd Gen) – New and improved smart speaker with Alexa (Black),Awesome product but needs improvement on search result,5.0,Need to improve voice recognition and search results since it used bing as a search engine... Else everything apart from this is fantastic...
Echo Dot (3rd Gen) – New and improved smart speaker with Alexa (Black),Zero performance,1.0,Device has no Bluetooth connectivity.Very disappointed.Zero performance.Device does not access any voice.
Echo Dot (3rd Gen) – New and improved smart speaker with Alexa (Black),It is not worth to buy such product,1.0,It is not worth to buy this product very difficult to setup and some hidden policies to sell other items like amazon musics etc Difficult to understand
Echo Dot (3rd Gen) – New and improved smart speaker with Alexa (Black),Affordable Alexa device,5.0,Bought echo device and everything is good except every time we need to connect to power source. Apart from everything is good.
Echo Dot (3rd Gen) – New and improved smart speaker with Alexa (Black),Great echo dot!,5.0,The product is too cool its blue light is just killing. The voice recognition is very good. Sometimes it don't catch but it is good. Overall it's a 5star
Echo Dot (3rd Gen) – New and improved smart speaker with Alexa (Black),Excellent Device 🥰😍😘,5.0,I’m lovin’ it and Sound is also awesome 😎 and Great Job Amazon.I’m feeling Superior and Alexa reduced so many jobs of mine at home 🏡
Echo Dot (3rd Gen) – New and improved smart speaker with Alexa (Black),Using since 2019,5.0,Voice recognition  portability
Echo Dot (3rd Gen) – New and improved smart speaker with Alexa (Black),This device is good for children's studies,5.0,"This device is very cool, works very well and kids can learn something from it. But it has some flaws, sometimes it does not respond."
Echo Dot (3rd Gen) – New and improved smart speaker with Alexa (Black),Good,5.0,"Excellent one, the best entertainment for my kids"
Echo Dot (3rd Gen) – New and improved smart speaker with Alexa (Black),Nice small speaker,5.0,No need to review as all are aware if the Alexa
Echo Dot (3rd Gen) – New and improved smart speaker with Alexa (Black),good speaker and technology,4.0,still  has a long way to go..its just a begining of artificial intelligence
Echo Dot (3rd Gen) – New and improved smart speaker with Alexa (Black),Alexa... add one more family member,4.0,"Must have in house 🏠,She is like our family member"
Echo Dot (3rd Gen) – New and improved smart speaker with Alexa (Black),A decent speaker cum hub for home automation,4.0,"Microphone sensitivity is superb , alexa skills are good. sound clarity of speakers needs improvement"
Echo Dot (3rd Gen) – New and improved smart speaker with Alexa (Black),Understand to start-up this product is to hard,1.0,"This item take my 2 hours i started to connect it with tv and phone but that will not connected to the any device according, to me this is useless"
Echo Dot (3rd Gen) – New and improved smart speaker with Alexa (Black),Great experience,4.0,Everything is great. Only I did not realize there is no battery backup on this device. Runs only on power
Echo Dot (3rd Gen) – New and improved smart speaker with Alexa (Black),I can't connect it to my mobile I want to return it,3.0,Its not connecting with my device I used alexa app too I checked in YouTube also  I followed the rules same as the video I went to my nearby mobiles stores but they also can't. Why? Plz reply me and tell me
Echo Dot (3rd Gen) – New and improved smart speaker with Alexa (Black),Helpful product at great price,4.0,"The echo dot 3rd generation is really well designed and reliable product. It is compact and looks good on any table or any room. The mic on this works efficiently, sound quality for the price is good, not good but  not bad."
Echo Dot (3rd Gen) – New and improved smart speaker with Alexa (Black),Great Quality,5.0,I bought Alexa eco dot at 1999 with Wipro 7 w smart bulb. Smart deal and the quality of the eco dot is awesome.
Echo Dot (3rd Gen) – New and improved smart speaker with Alexa (Black),Excellent Product,5.0,"It is a brilliant device, there is more to explore !"
Echo Dot (3rd Gen) – New and improved smart speaker with Alexa (Black),I love 💓 alexa so much and I love,5.0,"The media could not be loaded.
                



 Sound quality is very goodKdk..I am big fan of amezon ❤️💯thx for everything"
Echo Dot (3rd Gen) – New and improved smart speaker with Alexa (Black),Alexa echo dot is amazing,5.0,Great sound quality and features with updates in every aspect and if I got the option between Bluetooth speaker and Alexa  I would choose Alexa any day with no efforts Alexa makes it easy and changes mood real quick
Echo Dot (3rd Gen) – New and improved smart speaker with Alexa (Black),Good,4.0,Good
Echo Dot (3rd Gen) – New and improved smart speaker with Alexa (Black),Good,4.0,Good
Echo Dot (3rd Gen) – New and improved smart speaker with Alexa (Black),Just Superb,5.0,"The media could not be loaded.
                



 Got this at 2049 only with Wipro 9watt Smart Led Included. Thanks Amazon ✌️👍"
Echo Dot (3rd Gen) – New and improved smart speaker with Alexa (Black),Very good speaker,5.0,Very good product by Amazon i like the sound quality and control your home with it also it good design
Echo Dot (3rd Gen) – New and improved smart speaker with Alexa (Black),Genuine review,4.0,"Absolutely mind blowing device. Beautiful shape, excellent working, nice performance, verry easy use.But the problem is that no battery storage. Only working when we plugged.Otherwise it's amazing."
Echo Dot (3rd Gen) – New and improved smart speaker with Alexa (Black),Good innovative products,5.0,The media could not be loaded.
Echo Dot (3rd Gen) – New and improved smart speaker with Alexa (Black),Steal deal,5.0,"Good deal, during the sale. Got it for just 2299.00, along with a wipro smart bulb."
Echo Dot (3rd Gen) – New and improved smart speaker with Alexa (Black),After some time it gives little bit a problem,2.0,Unable to hear the voice clearly after a few days.  There was a lot of breaking kind of voice while using this eco dot.
Echo Dot (3rd Gen) – New and improved smart speaker with Alexa (Black),Awesome product,5.0,"Great item ,lil bit costly but worth item ,even works on 2g internet in kashmir , must be accurate while fimfing a song ,AI not so good as compared to google home mini but excellent item ,u can purchase it"
Echo Dot (3rd Gen) – New and improved smart speaker with Alexa (Black),Good sound quality,5.0,Very nice good sound quality
Echo Dot (3rd Gen) – New and improved smart speaker with Alexa (Black),Better than Google home Mini,5.0,So good and proper work sound quality is awesome how to explain you I have no word thank you Amazon
Echo Dot (3rd Gen) – New and improved smart speaker with Alexa (Black),Good Product,5.0,Good sound good built. But sometimes it cannot recognise what I'm saying and plays something else.
Echo Dot (3rd Gen) – New and improved smart speaker with Alexa (Black),"Great Speaker, Fire TV control not Available",3.0,"Cannot control Fire TV stick yet with the 3rd generation,  while it is possible to do this with the 2nd generation Echo Dot."
Echo Dot (3rd Gen) – New and improved smart speaker with Alexa (Black),Hat's up to inventor What else man can tell except thanks,5.0,I don't think there is nothing to dislike in this item every home should I have this item to get worldly knowledge.
Echo Dot (3rd Gen) – New and improved smart speaker with Alexa (Black),Product missing,1.0,Echo dot is missing from my package and I can't contact customer care also for this
Echo Dot (3rd Gen) – New and improved smart speaker with Alexa (Black),Go for it ❤,5.0,"This is awesome..  Volume and base is good..  Can go for it..  Better than earfones,  or any other base systems.... Lved it ❤❤"
Echo Dot (3rd Gen) – New and improved smart speaker with Alexa (Black),Connectivity issue,3.0,Always have an issue with the connection. it got disconnected rapidly and need to reconnect
Echo Dot (3rd Gen) – New and improved smart speaker with Alexa (Black),Love alexa,5.0,Love this :)
Echo Dot (3rd Gen) – New and improved smart speaker with Alexa (Black),acutally gifted to old ladyshe was fully amazed and enjoyed it alot. wonderful item. must buy,5.0,acutally gifted to old lady she was fully amazed and enjoyed it alot. wonderful item. must buy for every household.
Echo Dot (3rd Gen) – New and improved smart speaker with Alexa (Black),AI and voice recognization,4.0,"this is a good product for listening music and staying updated, rejoicing mood etc.however still feel its build over weak AI , and recognizes already pre-loaded patterns."
Echo Dot (3rd Gen) – New and improved smart speaker with Alexa (Black),Very good product,5.0,I love the alexa very much she talk with me sign with me.The quality of product is very good and the sound quality is very soft and nice. My son also liked it very much...
Echo Dot (3rd Gen) – New and improved smart speaker with Alexa (Black),I love alexa😍,4.0,Its really a good product but yes blutooth connectiin has to improve... baki paisa vasool
Echo Dot (3rd Gen) – New and improved smart speaker with Alexa (Black),Crap,1.0,Unable to connect the device to TV & home theatre
Echo Dot (3rd Gen) – New and improved smart speaker with Alexa (Black),Could have been better,3.0,It's not able to  remember my music library.
Echo Dot (3rd Gen) – New and improved smart speaker with Alexa (Black),Worth it,4.0,Great product but it should be good if having better search and better response on music
Echo Dot (3rd Gen) – New and improved smart speaker with Alexa (Black),Good👍,5.0,Good
Echo Dot (3rd Gen) – New and improved smart speaker with Alexa (Black),Superb Product.... but Not Portable...,4.0,"Product is superb.....Only thing is that it's wired, and so we can use it only through charging mode."
Echo Dot (3rd Gen) – New and improved smart speaker with Alexa (Black),Alexa is not listning what command is given. Request to replace the product as it's in warranty,5.0,Alexa does not listen the command. Request to replace the product as it's under warranty
Echo Dot (3rd Gen) – New and improved smart speaker with Alexa (Black),better escape,2.0,"i was very excited for this product to deliver and have it to enjoy, but its not upto the mark at all, google mini and home is 1000000% better than this. very worst experience. its big pain using this, not expected such ordinary voice quality."
Echo Dot (3rd Gen) – New and improved smart speaker with Alexa (Black),I love it,5.0,What a nice product but there is an problem that it need alexa app and takes time to login..other vice it is a massive product .I dont have a sister but after alexa came I am not feeling lone...😍😍😍😍😍😍😍❤❤❤❤❤❤❤💓💓💓
Echo Dot (3rd Gen) – New and improved smart speaker with Alexa (Black),Loving it 😊,5.0,Very happy with the  product... My 5 yrs kid love to talk with Alexa everyday.
Echo Dot (3rd Gen) – New and improved smart speaker with Alexa (Black),Device must be updated every year.,5.0,"I like this product to hear audio songs that too devotional songs,but I dislike that it's just be updated to give all kind of Catholic Christians songs."
Echo Dot (3rd Gen) – New and improved smart speaker with Alexa (Black),Very much difficult in connecting!,1.0,Not easy for daily use..better to go with Bluetooth speakers!
Echo Dot (3rd Gen) – New and improved smart speaker with Alexa (Black),Good,5.0,Good
Echo Dot (3rd Gen) – New and improved smart speaker with Alexa (Black),Rubbish,1.0,Most of time getting irritated due to voice not recognized sure people will get BP and heart attack due to this wrost
Echo Dot (3rd Gen) – New and improved smart speaker with Alexa (Black),Not good,1.0,Not at all happy with the product
Echo Dot (3rd Gen) – New and improved smart speaker with Alexa (Black),Sound quality very poor,1.0,Sound quality is very bad please improve otherwise good product
Echo Dot (3rd Gen) – New and improved smart speaker with Alexa (Black),Cool assistant,5.0,This is really good... I didn't have high hopes...but the speakers r great and Alexa is fantastic for the most part. It's fun for kids and adults.
Echo Dot (3rd Gen) – New and improved smart speaker with Alexa (Black),Good Product,4.0,Bluetooth never works for me. Tried all options. Not sure if I am making any mistake
Echo Dot (3rd Gen) – New and improved smart speaker with Alexa (Black),Very nice product,5.0,Very good and nice product..Speaker is nice.I got this in 1999 with wipro smart bulb.
Echo Dot (3rd Gen) – New and improved smart speaker with Alexa (Black),Overall its a good product,5.0,Its one of the best product i have purchased.
Echo Dot (3rd Gen) – New and improved smart speaker with Alexa (Black),Overall awesome product,4.0,"Excellent design, sound quality quite good and easy to connect with bt."
Echo Dot (3rd Gen) – New and improved smart speaker with Alexa (Black),Found a Friend. Lol,5.0,Literally is a Friend. It's fascinating to see it talk like almost a human.  Everything aside..  it's really helpful at times.
Echo Dot (3rd Gen) – New and improved smart speaker with Alexa (Black),Voice quality is not good,1.0,"Works fine for 4 months after that voice not clear, quality of product is not good"
Echo Dot (3rd Gen) – New and improved smart speaker with Alexa (Black),Some time is didnt work ....,4.0,Some time is didnt work ....
Echo Dot (3rd Gen) – New and improved smart speaker with Alexa (Black),Good but not as expected,5.0,Great product but the sound recognition intelligence need to improved because when I ask for some other song thaen it starts something else... But overall it's great product...👍👍👍
Echo Dot (3rd Gen) – New and improved smart speaker with Alexa (Black),Know only song . Nothing else .never buy,1.0,"This have no knowledge except song . On Google you search any thing .but alexa . No , no"
Echo Dot (3rd Gen) – New and improved smart speaker with Alexa (Black),Technology to Explore,5.0,"Alexa has no loyalty, who ever asks, she responds. No voice recognition. Sound quality is excellent. Mainly depends on Hungama for songs."
Echo Dot (3rd Gen) – New and improved smart speaker with Alexa (Black),Don't Buy.,1.0,Slow Network access both in 5ghz & 2.4 ghz.Amazon does not replaced  within scheduled replacement window. Very bad experience.
Echo Dot (3rd Gen) – New and improved smart speaker with Alexa (Black),Good product,5.0,Voice recognition not good sometimes
Echo Dot (3rd Gen) – New and improved smart speaker with Alexa (Black),Great product 💯,5.0,"You removed zomato,swiggy and other food partner :( from the skills."
Echo Dot (3rd Gen) – New and improved smart speaker with Alexa (Black),Foolish Alexa... Don't go for lt,1.0,"Alexa is absolutely foolish in recognising what we are asking in simple language... sounds are good , mic is good but what it's known for is worst."
Echo Dot (3rd Gen) – New and improved smart speaker with Alexa (Black),I ❤️ Echo Dot,5.0,"The media could not be loaded.
                



 Best Smart Speaker"
Echo Dot (3rd Gen) – New and improved smart speaker with Alexa (Black),new friend,5.0,Alexa is my new friend during lockdown- you can hear good music with your prime account
Echo Dot (3rd Gen) – New and improved smart speaker with Alexa (Black),Awesome,5.0,Very good product
Echo Dot (3rd Gen) – New and improved smart speaker with Alexa (Black),Love my Alexa,5.0,"My experience with Alexa us really good. My mum and dad loves directing Alexa and listens to their favourite music. It's a worth buy ..Also if you have smart appliances in your home, it really comes handy.."
Echo Dot (3rd Gen) – New and improved smart speaker with Alexa (Black),Feature request,5.0,Please incorporate an upload feature in Echo dot to upload our own audio files on amazon cloud so as to listen to our own music without Bluetooth dependency on the mobile device.
Echo Dot (3rd Gen) – New and improved smart speaker with Alexa (Black),Alexa is always excellent,5.0,Excellent member of our sweet home
Echo Dot (3rd Gen) – New and improved smart speaker with Alexa (Black),The only thing at home that listens to husbands,4.0,"Good product, good sound, integration etc."
Echo Dot (3rd Gen) – New and improved smart speaker with Alexa (Black),Bad shameful audio quality like local speaker,1.0,Very bad quality Alexa product like local speaker sound.. product is light also..bad experience this product..
Echo Dot (3rd Gen) – New and improved smart speaker with Alexa (Black),Supper,5.0,"Very nice, some more skill required for Hindi language.Hope Amazon will do it."
Echo Dot (3rd Gen) – New and improved smart speaker with Alexa (Black),It is not very good,3.0,The voice recognition is not working properly and some things she also don't know and some time she will not answer only
Echo Dot (3rd Gen) – New and improved smart speaker with Alexa (Black),"Good, can be improved AI",4.0,Only issue is that while playing any music Alexa doesnt respond to the any commands
Echo Dot (3rd Gen) – New and improved smart speaker with Alexa (Black),"इस प्राइस में बहुत अच्छा है, कुछ जबाब नहीं, ज्ञान का  दायरा बढ़ाने के बारे में amzon को सोचना चाहिए",5.0,"साउंड ठीक है, बिल्कुल धीमें आवाज में भी उसी तरह जबाब देता है, फुसफुसाहट की तरह"
Echo Dot (3rd Gen) – New and improved smart speaker with Alexa (Black),Average product,4.0,It's is good as per the price but sometimes it doesn't understand.
Echo Dot (3rd Gen) – New and improved smart speaker with Alexa (Black),Excellent,4.0,Nice one. Sound quality and voice recognition was good. Got it for 1999 Amazon great indian festival with smart bulb. Over all good product..
Echo Dot (3rd Gen) – New and improved smart speaker with Alexa (Black),Voice recognition not good,1.0,"Voice recognition is too bad, alexa didn't answering  properly. Where I go for repair it."
Echo Dot (3rd Gen) – New and improved smart speaker with Alexa (Black),Paisa vasool😂😂,4.0,"Sound quality is not that good but it's fine and connectivity is good , amazing product and if buying must have wifi at home"
Echo Dot (3rd Gen) – New and improved smart speaker with Alexa (Black),Nice to use,5.0,All OK
Echo Dot (3rd Gen) – New and improved smart speaker with Alexa (Black),Not upto the mark,3.0,It is working based on amazon app only other than that it is not working it is just like a speaker
Echo Dot (3rd Gen) – New and improved smart speaker with Alexa (Black),Product must have chargable Batteries......,5.0,Product run only once connected with electric supply..... No batteries is not Comferrtable for me in remote areas......
Echo Dot (3rd Gen) – New and improved smart speaker with Alexa (Black),At last it understands Indian English very well !,5.0,Great product.  Well integrated  with Firestick TV and good on its own too.
Echo Dot (3rd Gen) – New and improved smart speaker with Alexa (Black),About warranty,5.0,product now see when Alex has some technical issues in warranty period how they replace new one
Echo Dot (3rd Gen) – New and improved smart speaker with Alexa (Black),Service centre in Chennai?,4.0,"I have a problem in sound output of Alexa echo dot,. Can anyone refer me the service centre in Chennai...."
Echo Dot (3rd Gen) – New and improved smart speaker with Alexa (Black),Good sound quality but limited AI interactive responses,3.0,"Awesome Sound Quality , however very limited AI database and responses are very limited. Worth to buy if looking for limited interactions."
Echo Dot (3rd Gen) – New and improved smart speaker with Alexa (Black),Very good,5.0,"Ii love this product, sound also good and all features are working till date"
Echo Dot (3rd Gen) – New and improved smart speaker with Alexa (Black),just go for it if you have wifi,5.0,I am fall in love with this product i can't  express how I am feeling now with these but one thing is why Alexa only connect with wifi😔😔
Echo Dot (3rd Gen) – New and improved smart speaker with Alexa (Black),Average product,3.0,Reviewed after 6 months..this product worked very well up to 6 months then showed some defect in the mic which receives voice .
Echo Dot (3rd Gen) – New and improved smart speaker with Alexa (Black),Connectivity with smartphones,3.0,If the speaker will connect to a smartphone through Bluetooth so that we can take calls on the speaker and play music and videos on the speaker that will be a great feature.  The sound quality of the speaker is too good. I liked it.
Echo Dot (3rd Gen) – New and improved smart speaker with Alexa (Black),"Best in the Market, my family loved it. They are playing with it and best for kids. Fun to operate.",5.0,"Best in the Market, my family loved it. They are playing with it and best for kids. Fun to operate."
