product_name,title,stars,body
Echo Dot (3rd Gen) – New and improved smart speaker with Alexa (Black),Amazing Alexa,5.0,Alexa 3rd generation Echo is amazing with great sound.Just more songs vocabulary required but it's good.
Echo Dot (3rd Gen) – New and improved smart speaker with Alexa (Black),I thought it has inbuilt batter,3.0,"Good product, good for auromation and music, but lacks interna battery."
Echo Dot (3rd Gen) – New and improved smart speaker with Alexa (Black),Not happy...it has to b plugged in all the time,1.0,It needs plug in all the timeNot happyCan it b replaced
Echo Dot (3rd Gen) – New and improved smart speaker with Alexa (Black),Not satisfied,4.0,"More description about what the product is what is required for it to work and other details(Wi-Fi connection is compulsory, electricity is compulsory) must be given clearly"
Echo Dot (3rd Gen) – New and improved smart speaker with Alexa (Black),Alexa naughty,5.0,Very nice go head
Echo Dot (3rd Gen) – New and improved smart speaker with Alexa (Black),But without WiFi not play,4.0,Nice voice..enjoy but without WiFi ... didn't play
Echo Dot (3rd Gen) – New and improved smart speaker with Alexa (Black),Awesome,5.0,It is better than other speakers.Must buy 😍
Echo Dot (3rd Gen) – New and improved smart speaker with Alexa (Black),Sdg I k,1.0,Demonstrate  .jgylCan h डीलरों एवं का एक wuite बन l
Echo Dot (3rd Gen) – New and improved smart speaker with Alexa (Black),It's useful and good,5.0,I like this product it's very useful and portable.... We can control all the devices with just a command...
Echo Dot (3rd Gen) – New and improved smart speaker with Alexa (Black),"good sound, need to be update on Hindi language",5.0,"sound is good, but plz update language settings as Indian Hindi languagelike google home work in Hindi too"
Echo Dot (3rd Gen) – New and improved smart speaker with Alexa (Black),गुड,5.0,पसन्द है
Echo Dot (3rd Gen) – New and improved smart speaker with Alexa (Black),Inbuilt,2.0,Not working without power.. As inbuilt battery not available.. That's needs to improve.
Echo Dot (3rd Gen) – New and improved smart speaker with Alexa (Black),cool,5.0,great
Echo Dot (3rd Gen) – New and improved smart speaker with Alexa (Black),About,5.0,"This is good product but some times,  it doesn't respond us ."
Echo Dot (3rd Gen) – New and improved smart speaker with Alexa (Black),Very good product,5.0,"The media could not be loaded.
                



 I'm going with it."
Echo Dot (3rd Gen) – New and improved smart speaker with Alexa (Black),मेरे लिये बहुत उपयोगी उपकरण साबित हुआ ।,5.0,सँगीत और ज्ञान के लिये व दैनिक कार्यों में भी मदद मिल सकती हैं।
Echo Dot (3rd Gen) – New and improved smart speaker with Alexa (Black),Very good,5.0,Very goood.
Echo Dot (3rd Gen) – New and improved smart speaker with Alexa (Black),Review,5.0,Nice performance but amazon would improve the quality of sound a bit
Echo Dot (3rd Gen) – New and improved smart speaker with Alexa (Black),Value for money,5.0,Best device
Echo Dot (3rd Gen) – New and improved smart speaker with Alexa (Black),Excellent,5.0,Excellent
Echo Dot (3rd Gen) – New and improved smart speaker with Alexa (Black),Waste of money,1.0,Not a great product to buy. Waste of money
Echo Dot (3rd Gen) – New and improved smart speaker with Alexa (Black),"Smart ,but low sound",3.0,"Alexa is very useful for those who have schedules, listen newsBut the only concern is about the speaker ,it has  low sound , for eg not hearable from 1room to another"
Echo Dot (3rd Gen) – New and improved smart speaker with Alexa (Black),Ok product,5.0,Xpected better response.
Echo Dot (3rd Gen) – New and improved smart speaker with Alexa (Black),Simply wowww,5.0,Simply the vest. I bought it in the sale and grabbed at lowest price...
Echo Dot (3rd Gen) – New and improved smart speaker with Alexa (Black),Great,5.0,For price is good
Echo Dot (3rd Gen) – New and improved smart speaker with Alexa (Black),Speaker quality,5.0,Nice smart speaker 👍
Echo Dot (3rd Gen) – New and improved smart speaker with Alexa (Black),Awesome 😎,5.0,Good product overall but couldn’t connect with my sound system via Bluetooth 😔
Echo Dot (3rd Gen) – New and improved smart speaker with Alexa (Black),Simply superuuuu,5.0,Audio
Echo Dot (3rd Gen) – New and improved smart speaker with Alexa (Black),Worst experience,2.0,"Voice recognition is horrible, never expected it to be so worst, need to literally scream 2-3 times that's when she plays the music"
Echo Dot (3rd Gen) – New and improved smart speaker with Alexa (Black),Alexa Alexa..🙋‍♀️,4.0,"Delivery Timely, Excellent Sound Quality, I like Smart Alaxa 🙂"
Echo Dot (3rd Gen) – New and improved smart speaker with Alexa (Black),Great product,5.0,Great product but sound quality could have been improved and bass could be improved as well but overall a great product
Echo Dot (3rd Gen) – New and improved smart speaker with Alexa (Black),If i asked any song it plays some other. Not so good. Better to take google nest mini,2.0,Not able to answer questions and giving something else
Echo Dot (3rd Gen) – New and improved smart speaker with Alexa (Black),Good product to buy for a medium home.,5.0,"Everything is fine but,when u try to say something to Alexa from little far distance it does not respond"
Echo Dot (3rd Gen) – New and improved smart speaker with Alexa (Black),Nice Speaker,5.0,Very nice.... Enjoying it...
Echo Dot (3rd Gen) – New and improved smart speaker with Alexa (Black),Awesome,4.0,It's good and working fine
Echo Dot (3rd Gen) – New and improved smart speaker with Alexa (Black),Awesome product from amozon .......,5.0,Awesome product from amozon
Echo Dot (3rd Gen) – New and improved smart speaker with Alexa (Black),Average,3.0,I didn’t like the sound quality much.
Echo Dot (3rd Gen) – New and improved smart speaker with Alexa (Black),Nice product,5.0,Good
Echo Dot (3rd Gen) – New and improved smart speaker with Alexa (Black),Amazing at low price,5.0,Voice recognition and quality of sound is very good
Echo Dot (3rd Gen) – New and improved smart speaker with Alexa (Black),problem with remainders,4.0,Yellow light keeps blinking continuously even when there aren't any messages or notifications
Echo Dot (3rd Gen) – New and improved smart speaker with Alexa (Black),Awesome,5.0,It's awesome
Echo Dot (3rd Gen) – New and improved smart speaker with Alexa (Black),Sound quality needs a lot of improvement.,3.0,The media could not be loaded.
Echo Dot (3rd Gen) – New and improved smart speaker with Alexa (Black),Excellent product...,5.0,Nothing what I disliked...and liked so much then after this have purchased another 02 unit to gift relatives...
Echo Dot (3rd Gen) – New and improved smart speaker with Alexa (Black),Audio issue,4.0,The product has been great but i have a issue.The audio is getting a bit distorted. it would be great if you could fix the problem or provide a replacement
Echo Dot (3rd Gen) – New and improved smart speaker with Alexa (Black),Not working properly  in between goes off,5.0,I dislike your product because in between goes off and never starts 😒
Echo Dot (3rd Gen) – New and improved smart speaker with Alexa (Black),Very good,4.0,I am really thankful to amazon... This product I bought when my daughter told me.Thank u amazon
Echo Dot (3rd Gen) – New and improved smart speaker with Alexa (Black),Alexa,2.0,Bluetooth conectivity poorAlexa integration is averageVoice recognition not satisfied
Echo Dot (3rd Gen) – New and improved smart speaker with Alexa (Black),"Superb voice & commands, must have in your home",5.0,Home automation & song & commands
Echo Dot (3rd Gen) – New and improved smart speaker with Alexa (Black),Ultimate,5.0,We will enjoy all the time with alexa that is nice invention
Echo Dot (3rd Gen) – New and improved smart speaker with Alexa (Black),Good,4.0,Good
Echo Dot (3rd Gen) – New and improved smart speaker with Alexa (Black),Love the sound!!,4.0,Nice device
Echo Dot (3rd Gen) – New and improved smart speaker with Alexa (Black),Very Very Very Nice Thing,5.0,Alexa is very good thing it will help us to study it is very good Alexa will control our Full home we want to just say Alexa
Echo Dot (3rd Gen) – New and improved smart speaker with Alexa (Black),Alexa,5.0,Everything is good except Bluetooth connection
Echo Dot (3rd Gen) – New and improved smart speaker with Alexa (Black),Amazing product!,5.0,Worth buying.
Echo Dot (3rd Gen) – New and improved smart speaker with Alexa (Black),Not working properly want to replace,1.0,Not working properly want to replace dot
Echo Dot (3rd Gen) – New and improved smart speaker with Alexa (Black),Quality,5.0,Really loved the product. Amazing sound quality as well.
Echo Dot (3rd Gen) – New and improved smart speaker with Alexa (Black),Good,4.0,Good
Echo Dot (3rd Gen) – New and improved smart speaker with Alexa (Black),Good,4.0,"Its very good, my 5 years getting all the new futures, If it is in Kannada good,"
Echo Dot (3rd Gen) – New and improved smart speaker with Alexa (Black),Best now Alexa is a part of my family,5.0,Best smart speaker
Echo Dot (3rd Gen) – New and improved smart speaker with Alexa (Black),Satisfied product it is really good 👍 Love ❤it,5.0,Satisfied product it is really good 👍Love ❤it
Echo Dot (3rd Gen) – New and improved smart speaker with Alexa (Black),Good,5.0,Great
Echo Dot (3rd Gen) – New and improved smart speaker with Alexa (Black),need better sound,3.0,not happy with the sound quality
Echo Dot (3rd Gen) – New and improved smart speaker with Alexa (Black),Don't even think to buy don't follow YouTube videos reviews,1.0,Not worthy for money. Alexa doesn't know anything as and when you ask no knowledge.
Echo Dot (3rd Gen) – New and improved smart speaker with Alexa (Black),Real review .... By common man,5.0,Looks cool to be ina techno world .... Sooperb product ... Still something's must be improve...rather than that awesome experience with ALEXA.
Echo Dot (3rd Gen) – New and improved smart speaker with Alexa (Black),A good innovative speaker,5.0,A really amazing product.  But I am unable to connect it with my computer even after getting it replaced once.
Echo Dot (3rd Gen) – New and improved smart speaker with Alexa (Black),Love alexa,5.0,Great product by Amazon.. perfect time pass.. thanks for this amazing thing
Echo Dot (3rd Gen) – New and improved smart speaker with Alexa (Black),Awesome product,5.0,Awesome product.. quality is good.
Echo Dot (3rd Gen) – New and improved smart speaker with Alexa (Black),Liked it,5.0,Product is nice and works well.
Echo Dot (3rd Gen) – New and improved smart speaker with Alexa (Black),Speaker is not nice,3.0,Its nice but the speaker is not clear while atory telling
Echo Dot (3rd Gen) – New and improved smart speaker with Alexa (Black),Go for it,5.0,Great sound and quick voice recognition. It's quite a deal.
Echo Dot (3rd Gen) – New and improved smart speaker with Alexa (Black),My review,5.0,Alexa is OPBut if you want alexa buy only Black colourAs other colours are tatti 👋
Echo Dot (3rd Gen) – New and improved smart speaker with Alexa (Black),Not a Bluetooth product,1.0,Most disappointed. Heavy net usage.
Echo Dot (3rd Gen) – New and improved smart speaker with Alexa (Black),Good sound,4.0,Good sound
Echo Dot (3rd Gen) – New and improved smart speaker with Alexa (Black),Alexa music,5.0,Everything was good. But I wish Alexa had an add on option where I can play my playlist through gaaana app
Echo Dot (3rd Gen) – New and improved smart speaker with Alexa (Black),Home is here,5.0,Very addictive
Echo Dot (3rd Gen) – New and improved smart speaker with Alexa (Black),Very good 😊,5.0,Very nice products
Echo Dot (3rd Gen) – New and improved smart speaker with Alexa (Black),Disappointment,2.0,The biggest disadvantage is that this speaker stops working once it is plugged off from the socket. Otherwise everything else is very good in it.
Echo Dot (3rd Gen) – New and improved smart speaker with Alexa (Black),Alexa,3.0,"Its is very nice,but there is no battery in this."
Echo Dot (3rd Gen) – New and improved smart speaker with Alexa (Black),Good quality but if you have not subscribe prime it will not work properly,4.0,Good quality
Echo Dot (3rd Gen) – New and improved smart speaker with Alexa (Black),Do not buy this,1.0,Returning it waste of money to buy it
Echo Dot (3rd Gen) – New and improved smart speaker with Alexa (Black),Value for money,4.0,A great product but the only drawback being that it isn't portable
Echo Dot (3rd Gen) – New and improved smart speaker with Alexa (Black),Nice job,5.0,All is good but improving the hindi language.
Echo Dot (3rd Gen) – New and improved smart speaker with Alexa (Black),Awesome,5.0,I really loved it....alexa is superb..i should say everyone should buy it
Echo Dot (3rd Gen) – New and improved smart speaker with Alexa (Black),worth,4.0,really nice and this is now really helpful to avoid lonliness
Echo Dot (3rd Gen) – New and improved smart speaker with Alexa (Black),Nice product in this price,5.0,Nice product in this price
Echo Dot (3rd Gen) – New and improved smart speaker with Alexa (Black),SMART HOME,4.0,Best gadget to make your smart home
Echo Dot (3rd Gen) – New and improved smart speaker with Alexa (Black),Good buy,4.0,Alexa - wonderful concept but i could see limitations in it... it couldn't recognize instructions when it playing songs..... Doesn't play old tamil songs
Echo Dot (3rd Gen) – New and improved smart speaker with Alexa (Black),Echo dot not working,4.0,Echo dot not working pls provide service center detail
Echo Dot (3rd Gen) – New and improved smart speaker with Alexa (Black),Unexpected,5.0,I supried
Echo Dot (3rd Gen) – New and improved smart speaker with Alexa (Black),Voice not coming not  working properly,1.0,Sound quality and recognition problem not working properly
Echo Dot (3rd Gen) – New and improved smart speaker with Alexa (Black),Great product,5.0,Really great product very useful.
Echo Dot (3rd Gen) – New and improved smart speaker with Alexa (Black),Nice product,5.0,Nice device. Keeps you entertained every time. Sound quality is best.
Echo Dot (3rd Gen) – New and improved smart speaker with Alexa (Black),Product has stopped working.,2.0,"Hi,This product has stopped working.Its within the warranty currently.Look what best can be done."
Echo Dot (3rd Gen) – New and improved smart speaker with Alexa (Black),Good,4.0,Good Product
Echo Dot (3rd Gen) – New and improved smart speaker with Alexa (Black),Excellent,5.0,Good voice quality and voice command
Echo Dot (3rd Gen) – New and improved smart speaker with Alexa (Black),Good,4.0,Nice pies
Echo Dot (3rd Gen) – New and improved smart speaker with Alexa (Black),Must go for it,5.0,Awesome. I have ordered one more for my brother.
Echo Dot (3rd Gen) – New and improved smart speaker with Alexa (Black),Normal good,3.0,"The media could not be loaded.
                



 Sound not good and very loudly sound"
Echo Dot (3rd Gen) – New and improved smart speaker with Alexa (Black),Time pass product.,5.0,Alexa is a better product
Echo Dot (3rd Gen) – New and improved smart speaker with Alexa (Black),Best product to automation,5.0,Sightly listen low
Echo Dot (3rd Gen) – New and improved smart speaker with Alexa (Black),Thanks,5.0,
Echo Dot (3rd Gen) – New and improved smart speaker with Alexa (Black),Okok sound quality,4.0,Every this was fine but the sound quality is not as expected.
Echo Dot (3rd Gen) – New and improved smart speaker with Alexa (Black),Average,2.0,"The volume is not so loud and Alexa integration is not that good, better."
Echo Dot (3rd Gen) – New and improved smart speaker with Alexa (Black),Sound quality is very poor,3.0,"Sounds not clear, very noisy sound ,Where resolve this problem"
Echo Dot (3rd Gen) – New and improved smart speaker with Alexa (Black),Its awesome 😀☺,5.0,Its awsome I loved it its package was so good it was very easy to connect to the bulb life is very easy with it😄
Echo Dot (3rd Gen) – New and improved smart speaker with Alexa (Black),"Top quality,  good sound ever",5.0,Best
Echo Dot (3rd Gen) – New and improved smart speaker with Alexa (Black),Very beautiful product,5.0,This is a wonderful product and very nice buy
Echo Dot (3rd Gen) – New and improved smart speaker with Alexa (Black),Nice product,5.0,Nice product... and buy this item no need to purchase and music system....
Echo Dot (3rd Gen) – New and improved smart speaker with Alexa (Black),Lovely,5.0,"Amazing can't tell how nice it is , using since 1 year , loving it"
Echo Dot (3rd Gen) – New and improved smart speaker with Alexa (Black),Sound is super cute and lights  change this colour,5.0,"The media could not be loaded.
                



 Best sound and base I give him five ⭐⭐⭐⭐⭐"
Echo Dot (3rd Gen) – New and improved smart speaker with Alexa (Black),Worst alexa,1.0,Worst worst
Echo Dot (3rd Gen) – New and improved smart speaker with Alexa (Black),Its good,5.0,Its good fr using.Some time helpfull also.
Echo Dot (3rd Gen) – New and improved smart speaker with Alexa (Black),Go for it,5.0,Best Buy. It has converted our home to a smart home.
Echo Dot (3rd Gen) – New and improved smart speaker with Alexa (Black),Staisfied,5.0,Elexa is the best gadget for me bcoz i do all work with elexa it has got large field voice recognition with excellent sound quality
Echo Dot (3rd Gen) – New and improved smart speaker with Alexa (Black),Good,4.0,"Sound quality is good, voice recognition is good, very useful"
Echo Dot (3rd Gen) – New and improved smart speaker with Alexa (Black),Excellent combo... Works well,5.0,Must buy product at offer price. I got combo @1999 (wipro Smart 💡)
Echo Dot (3rd Gen) – New and improved smart speaker with Alexa (Black),A,1.0,Could not connect with wify. Only showing connected without internet.
Echo Dot (3rd Gen) – New and improved smart speaker with Alexa (Black),Product not working,3.0,After 2 month it's not working any more.
Echo Dot (3rd Gen) – New and improved smart speaker with Alexa (Black),Amazing Awesome Fantastic,5.0,Amazing! It is a awesome AI speaker alexa. Mind blowing voice recognition Very good speaking quality. Thanks Amazon.
Echo Dot (3rd Gen) – New and improved smart speaker with Alexa (Black),Good,5.0,Good
Echo Dot (3rd Gen) – New and improved smart speaker with Alexa (Black),Good products,5.0,Good products
Echo Dot (3rd Gen) – New and improved smart speaker with Alexa (Black),👍🏻,4.0,👍🏻
Echo Dot (3rd Gen) – New and improved smart speaker with Alexa (Black),Great,4.0,"Great product, I am enjoying it"
Echo Dot (3rd Gen) – New and improved smart speaker with Alexa (Black),Love it,5.0,Worth the price
Echo Dot (3rd Gen) – New and improved smart speaker with Alexa (Black),Good product,4.0,The product is good and has amazing sound quality with respect to it's size. It's useful if you have a stable wifi connection !
Echo Dot (3rd Gen) – New and improved smart speaker with Alexa (Black),Sound quality could be better,3.0,All fine just that sound quality could be better
Echo Dot (3rd Gen) – New and improved smart speaker with Alexa (Black),Below expectation,3.0,Speaker quality of Not as expected.....it’s just ok not awesome
Echo Dot (3rd Gen) – New and improved smart speaker with Alexa (Black),Nice sound,4.0,Voice Command  Reaction is very Poor
Echo Dot (3rd Gen) – New and improved smart speaker with Alexa (Black),Sounds good,5.0,Nice work
Echo Dot (3rd Gen) – New and improved smart speaker with Alexa (Black),Everything is perfect expect of packaging,5.0,Everything is perfect expect of packaging. I enjoy her everyday. 🤗🤪😍
Echo Dot (3rd Gen) – New and improved smart speaker with Alexa (Black),Worth The Money! 💯🔥,5.0,Far-field voice control is on point!🔥
Echo Dot (3rd Gen) – New and improved smart speaker with Alexa (Black),The product is not Useful,1.0,It is Useless product total LossIt Doesn't Understand Any Comman Indian Songs or BhajanEven can't SelectSongs of Kishore Kumar or Flim Sagar
Echo Dot (3rd Gen) – New and improved smart speaker with Alexa (Black),Amazing alexa,4.0,Alexa is just amazing.
Echo Dot (3rd Gen) – New and improved smart speaker with Alexa (Black),Youtube support nahi karta,3.0,Youtube support nahi karta...song recognises achha nahi he
Echo Dot (3rd Gen) – New and improved smart speaker with Alexa (Black),Good product,4.0,Nice pretty good might be worth buying
Echo Dot (3rd Gen) – New and improved smart speaker with Alexa (Black),Poor connectivity,1.0,Poor product and connectivity
Echo Dot (3rd Gen) – New and improved smart speaker with Alexa (Black),Voice is Too bassy and loud. Very irritating device.,1.0,Never recommend to others.
Echo Dot (3rd Gen) – New and improved smart speaker with Alexa (Black),Nice,5.0,Lovely
Echo Dot (3rd Gen) – New and improved smart speaker with Alexa (Black),Average,2.0,Average
Echo Dot (3rd Gen) – New and improved smart speaker with Alexa (Black),Fun...,5.0,Fun...
Echo Dot (3rd Gen) – New and improved smart speaker with Alexa (Black),Gud,5.0,Gud
Echo Dot (3rd Gen) – New and improved smart speaker with Alexa (Black),Value for money,5.0,The sound and base is best in this range best AI assistant
Echo Dot (3rd Gen) – New and improved smart speaker with Alexa (Black),User friendly product.,5.0,Good Product
Echo Dot (3rd Gen) – New and improved smart speaker with Alexa (Black),Spekar should be like Sony & boat,5.0,Power not contactingAlexa power not comingPlease any Technision arrangemeCallem
Echo Dot (3rd Gen) – New and improved smart speaker with Alexa (Black),I don't use it,1.0,"I didn't use it, I don't open the box."
Echo Dot (3rd Gen) – New and improved smart speaker with Alexa (Black),👍🏻,4.0,👍🏻
Echo Dot (3rd Gen) – New and improved smart speaker with Alexa (Black),A new member to family,5.0,"Really happy to have this, my parents are enjoying with it a lot, as AI is something very new to them. Worth the money!"
Echo Dot (3rd Gen) – New and improved smart speaker with Alexa (Black),Sound quality is supurb.,3.0,"Not supported all music sites, was unable to recognize what you say."
Echo Dot (3rd Gen) – New and improved smart speaker with Alexa (Black),Only  bluetooth problem,1.0,Bluetooth problem -main Bluetooth se connect karta hun to uske bad sound aati hai
Echo Dot (3rd Gen) – New and improved smart speaker with Alexa (Black),Value for money,5.0,Best purchase 👍
Echo Dot (3rd Gen) – New and improved smart speaker with Alexa (Black),Good.,4.0,Good.
Echo Dot (3rd Gen) – New and improved smart speaker with Alexa (Black),Amazing,5.0,This product is amazing.I love it.It is great value for money
Echo Dot (3rd Gen) – New and improved smart speaker with Alexa (Black),Not Good sound quality,1.0,It's not good as i heared voice is not much good
Echo Dot (3rd Gen) – New and improved smart speaker with Alexa (Black),Awesome AI,5.0,Liked this and will recommend all users of prime
Echo Dot (3rd Gen) – New and improved smart speaker with Alexa (Black),Superb,5.0,Superb
Echo Dot (3rd Gen) – New and improved smart speaker with Alexa (Black),Voice recognition issues are there.,5.0,Should improve the voice recognition.
Echo Dot (3rd Gen) – New and improved smart speaker with Alexa (Black),Their should be returnable option,4.0,"I love it!  It helps me a lot but,  for this u should have two mobiles otherwise it will take time in loading"
Echo Dot (3rd Gen) – New and improved smart speaker with Alexa (Black),Ok,4.0,It has limited itself with respect to songs playing option
Echo Dot (3rd Gen) – New and improved smart speaker with Alexa (Black),An OK device,3.0,"Sound performance is not at all good.and some features like home,links to music app are not applicable"
Echo Dot (3rd Gen) – New and improved smart speaker with Alexa (Black),Good . Sound quality could have been better,5.0,The media could not be loaded.
Echo Dot (3rd Gen) – New and improved smart speaker with Alexa (Black),This is return but there’s no response from your end,1.0,This is return goodIt’s not comfortable for me
Echo Dot (3rd Gen) – New and improved smart speaker with Alexa (Black),Not responding,1.0,"The media could not be loaded.
                



 Not Answering to my command"
Echo Dot (3rd Gen) – New and improved smart speaker with Alexa (Black),I love my Echo Dot Alexa😘😘😘,5.0,Very good 🥰🥰🥰
Echo Dot (3rd Gen) – New and improved smart speaker with Alexa (Black),Amazing,4.0,Amazing product. Just loved the product the only drawback is it works only when it is plugged.
Echo Dot (3rd Gen) – New and improved smart speaker with Alexa (Black),Accha ni laga,1.0,Accha hain magar 2 month baad issme pata ni kia hua chalta hi ni hain....
Echo Dot (3rd Gen) – New and improved smart speaker with Alexa (Black),NOT WORKING. NOT HAPPY WITH PRODUCT,1.0,The media could not be loaded.
Echo Dot (3rd Gen) – New and improved smart speaker with Alexa (Black),Charger missing,2.0,Protect is good bt.. Charger missing... Where Amazon
Echo Dot (3rd Gen) – New and improved smart speaker with Alexa (Black),Intelligent speaker,4.0,"Good sound, portable"
Echo Dot (3rd Gen) – New and improved smart speaker with Alexa (Black),Great product,5.0,Wonderful experience with Alexa for the first time....
Echo Dot (3rd Gen) – New and improved smart speaker with Alexa (Black),Good,5.0,"Alexa Skills are limited, many available in US not available in india"
