product_name,title,stars,body
Echo Dot (3rd Gen) – New and improved smart speaker with Alexa (Black),Received Defected product during Diwali Sale,2.0,I ordered the Echo Dot under the Amazon Big Diwali Sale and received it in a days time. As soon as I plugged it in it started flashing a green light without even being connected to a Wifi or the Alexa App. I returned the product and tried to get an exchange but Amazon didn't give an option. Finally disappointed I had to ask for a refund. I owned an Alexa prior to this which also got spoilt really soon. They are selling defected products under the sale banner.
Echo Dot (3rd Gen) – New and improved smart speaker with Alexa (Black),Sound quality and integration with other systems is very poor,2.0,"Likes:Ease of SetupEase of UseCollection RangeVoice REcognitionDislikes:Integration to other systems--I have Sonos but there is no Skill in India to control Sonos, same feature is available outside India. Wonder why it cannot be extend to IndiaSound Quality--There is lot of scope to improve sound quality, quality is very disturbing"
Echo Dot (3rd Gen) – New and improved smart speaker with Alexa (Black),Decent product with value for money,4.0,"Sound output is good for single room. Once it is connected to home theater system, it becomes an amazing product. One major lacuna it has is we have to keep it continuously plugged in. Still I feel its a value for money product with some amazing features."
Echo Dot (3rd Gen) – New and improved smart speaker with Alexa (Black),Not a good product,2.0,After 20 days microphone start giving problems..Had to give loud instructions with in 5 feet of range.I was thinking of buying 4th gen as well but stopped after seeing it's working
Echo Dot (3rd Gen) – New and improved smart speaker with Alexa (Black),Must Buy!!!,4.0,"Too good. Faster response. Awesome sound quality for this size speaker, Awesome lighting animations.Cons: Connecting with OnePlus tv is difficult/hurdle.If the phone is interconnected by Bluetooth it drains the phone's battery."
Echo Dot (3rd Gen) – New and improved smart speaker with Alexa (Black),Need some improvement in knowledge and answers,3.0,The speaker is of good quality. Searched many queries but when compared with Google then it lags in some answers where Google is mostly accurate but alexa is not. It only needs to upgrade the knowledge base/AI otherwise it is worth the money.
Echo Dot (3rd Gen) – New and improved smart speaker with Alexa (Black),Good...,4.0,"Excellent product, the sound output is also good with a decent amount of bass. Connectivity is good with Bluetooth and line in options. Most of time you will have to shout out if music is being played unlike Google.  Over all it a good product..."
Echo Dot (3rd Gen) – New and improved smart speaker with Alexa (Black),Performances,2.0,Echo dot not working after open every time and Alexa not take voice orderEvery time we try through alexa app or push the button in echo dot
Echo Dot (3rd Gen) – New and improved smart speaker with Alexa (Black),It is not being able to play Bengali Songs,2.0,"The media could not be loaded.
                



 Bought on 10th August, 2021.Alexa is not being able to play any bengali song. Beside that lots of songs are unavailable in Amazon Prime music. But Sound quality and voice recognition are very good. Other functionalities are also satisfying."
Echo Dot (3rd Gen) – New and improved smart speaker with Alexa (Black),Good but not the Best,4.0,"Review after 2 weeks usagePros1. Best sound quality i have ever heard on speaker segment2.Nice build quality3.Lots of skills available on alexa appCons1. Sometimes it will not listen to your voice properly2. Does not work without power3.Does not have a storage,so you have to turn wifi on always if you want to use this device.Overall satisfied with the technology 😉"
Echo Dot (3rd Gen) – New and improved smart speaker with Alexa (Black),Does it runs on battery,1.0,The product is good but the main drawback is it doesn't have inbuilt battery and we cannot use this speaker while travelling.If this product has the below feature than i would have given 5 on 51. Battery backup.2. Make calls to everyone doesn't matter the other person have Alexa.3. Aux connectivity.
Echo Dot (3rd Gen) – New and improved smart speaker with Alexa (Black),Dumb bot,2.0,"The product can't do much more than playing songs , it fails to tell distance , meaning , song search is awafull , fail to search article on internet, skills don't work . I was very excited to buy alexa after seeing advertisement on internet but I  really very disappointed after receiving it."
Echo Dot (3rd Gen) – New and improved smart speaker with Alexa (Black),Excellent,5.0,"The voice recognition was excellent as usual like other Alexa devices,the sound quality is better compared to other portable speakers.although the setting up process is  bit annoying if we didn't order it from our Amazon account.But overall still it's a excellent one..."
Echo Dot (3rd Gen) – New and improved smart speaker with Alexa (Black),Alexa is Good not the Best,4.0,"Alexa does pretty much all the job, sound quality is good, Microphone is good not the best. It does most of the job, but it lacs lot of knowledge as it is depended upon Wikipedia, if its not mentioned in wikipedia it wont answer. IF u ask it How are u, it always gives a std reply, which is bit irritating..It most of time blinks orange color to indicate it is waiting for a command word and we arent using it, which is a kind of spying."
Echo Dot (3rd Gen) – New and improved smart speaker with Alexa (Black),Voice is not recognising properly...,2.0,"I got this product in offer basis, product is good. But 2 issues I found: one is Alexa is not recognising the voice clearly and second one is she is not playing correctly what we are asking... They might be sent me a refurbished item, actually before that I don't know reg these issues before I saw my friends Alexa(Echo dot).. Really I am not satisfied on this product."
Echo Dot (3rd Gen) – New and improved smart speaker with Alexa (Black),Awesome device,5.0,Product is pretty good in other words it is awesome I am using this daily for streaming songs and weather forecast. Easy to install and easy access Bluetooth.Even my kids uses it to access rhymes. Thanks to AMAZONBut coming  to delivery it is too bad recently I have ordered two units in which I have received one and other one is not delivered till now customer care says that my products is in damage condition that is the reason it is not delivered.very unworthy reason from amazon Being a very big reputed company. I though of gifting it to my friend on 03-Oct-2019 as it was his bday but you people have disappointed me.
Echo Dot (3rd Gen) – New and improved smart speaker with Alexa (Black),Alexa has very good speaker .,4.0,It's very helpful for me I have to order sme thing I don't have to use my pn I have to only say'alexa buy that ''i have to say alexa turn on Wipro bulp ''i have to sy alexa turn on smart switch
Echo Dot (3rd Gen) – New and improved smart speaker with Alexa (Black),Worth a shot,5.0,"The sound quality is only average but gets the job done. Gets pretty loud though.If you listen to a lot of music using a Bluetooth speaker or something, in that case this becomes a great replacement. Smart + convenient.Worth a shot for sure!"
Echo Dot (3rd Gen) – New and improved smart speaker with Alexa (Black),Worth a upgrade,5.0,"I am very happy with this device as it has made my life easier, feel good to upgrade. The Bluetooth connection is good and the mic is really as mentioned in the product description. In short its a must buy device and oh yes I got this device to connect with the TCL 55 P series tv. Will connect it and come review again"
Echo Dot (3rd Gen) – New and improved smart speaker with Alexa (Black),Not exactly worth it unless you have smart appliances that supoport alexa,2.0,Integration takes too much time. Doesn't understand a lot of stuff and worst part is it needs to be connected all the time. Unable to connect to my mi smart android tv.Too much time and energy needs to be put in to set it up with anything. Not worth it.
Echo Dot (3rd Gen) – New and improved smart speaker with Alexa (Black),Good Enough!,4.0,Bought This For ₹2.5k And I Feel It's Good Enough For That Price Though. 2 Days Into It And There's Pretty Much Every Integration You Can Imagine Of! This Is Also My First Step Towards Home Automation And I'll Love To Do That In Future.
Echo Dot (3rd Gen) – New and improved smart speaker with Alexa (Black),Musical companion,5.0,Using it since Oct 2019. I am happy with the product.There is scope for improvement in voice recognition. Some intelligence is required in the product when you ask for regional language music.
Echo Dot (3rd Gen) – New and improved smart speaker with Alexa (Black),Super product,5.0,"I bought this device for 2k in prime sell. I am quite impressed with it.Below are the pros -1. Easy set up in 5 mins2. Integration with Airtel , Syska, Hungama, Wipro,Savan .. etc apps was was quite easy . Didn't face single issue.3. Sound is crystal clear and pleasing4. Looks amazingAnd many more..Cons - I couldn't find any."
Echo Dot (3rd Gen) – New and improved smart speaker with Alexa (Black),Great product and I loved it.,5.0,Great product and really I didn't expect that small speaker can have such a strong bass and great sound and also loud enough that can be headed from down stare . Really a great one.
Echo Dot (3rd Gen) – New and improved smart speaker with Alexa (Black),Only problem I observed,3.0,"Amazon should update these devices to enable it to use any open wi fi or hor spot. Otherwise you may need a dedicated wifi router or always available mobile phone. If both goes down Alexa goes down. Why to stick on a network, let it use any open wifi."
Echo Dot (3rd Gen) – New and improved smart speaker with Alexa (Black),Can we see her with her intelligent eyesight?,1.0,"Lady Alexa is 3rd gen,no more a kid,she is young ,can't go blild in a men's world at her prime young age,time.She should have Four Way eye sight to see and observe.Am I right dear ?I love her very much."
Echo Dot (3rd Gen) – New and improved smart speaker with Alexa (Black),Lovely gift for young children,4.0,I presented Eco Dot to my grand daughters . They are very happy & satisfied with it . They say that it is the best gift since now .  Now I am planning to buy for me to listen old & new  songs as well . In Deepawali sale I got this for 2500 ₹ with smart bulb . I am waiting for another sale .  Sarita Mishra
Echo Dot (3rd Gen) – New and improved smart speaker with Alexa (Black),Best Smart Speaker,5.0,One of the Best purchases. Sound Quality is Superb. Inexpensive. Alexa remains the best voice ecosystem for smart home control. Only con: It is not up to google assistant level while answering broad information queries
Echo Dot (3rd Gen) – New and improved smart speaker with Alexa (Black),Amazing but not portable,4.0,Portability is poor because it’s a wired device and doesn’t work without the power cord. Should have had batteries option too in which case one could call them portable. That said all other features are modern and quite useful too.
Echo Dot (3rd Gen) – New and improved smart speaker with Alexa (Black),"Not upto the mark, pathetic and sometimes not at all satisfied..",3.0,"Not that user friendly, infact. Many times it fails to understand our request and mainly cannot recognize kannada language movie songs..But voice recognition is good and other informations are well casted.. need more updates and should introduce all regional languages aeap."
Echo Dot (3rd Gen) – New and improved smart speaker with Alexa (Black),My first smart speaker,5.0,"The media could not be loaded.
                



 This was launched on 11th and I got the product by 12th. Plus the reduced price due to sale and a nice smart bulb for just 500 rupees. Overall I think this was super value for money. I haven't used any other smart speaker before but I am very happy with my purchase"
Echo Dot (3rd Gen) – New and improved smart speaker with Alexa (Black),Must buy!!!worth every penny !!,5.0,A must buy product but I’ll suggest buying while discount going on because I find it lil expensive but still it worth buying anyway 👍🏻👍🏻 My 6 year kid enjoys talking to alexa & playing songs on on it. My whole family loves it.
Echo Dot (3rd Gen) – New and improved smart speaker with Alexa (Black),It is super smart or maybe too smart,5.0,"This Alexa (echo dot) is super smart and it has sophisticated technology,if you have fire tv it is the best you can control the tv with your voice and it recognizes your voice perfetly. You can also play so many games with it and it is best for kids. You can also buy a smart lights to control it with your voice. It almost has every question you ask, you can also ask it to say a story or play music and much more"
Echo Dot (3rd Gen) – New and improved smart speaker with Alexa (Black),"Warm welcome my Alexa, love it",5.0,"The media could not be loaded.
                



 Crisp and clear sound with lots of fun.... I am loving it"
Echo Dot (3rd Gen) – New and improved smart speaker with Alexa (Black),Great speaker... Skill needs a tad more improvement,4.0,A great speaker love the sound.... And impressive voice recognitionCould do a tad better on the Alexa software as it takes location from the language you set also particular language settings only work with a particular skill... Also a youtube cast skill would be great
Echo Dot (3rd Gen) – New and improved smart speaker with Alexa (Black),Entertaining and helping kids learn new stuff,5.0,A great device. Not only making my experience of listing to music better but also helping my child in learning English better. Also has many skills which are making life easy and helping kid learning and exploring new stuff. Also got at an amazing price during the sale. :)
Echo Dot (3rd Gen) – New and improved smart speaker with Alexa (Black),Needs a lot of improvement.,3.0,"Ok, ok...i dint the product much. It needs a lot of tuning and improvement in terms of features and intelligence. Not a smart device. :("
Echo Dot (3rd Gen) – New and improved smart speaker with Alexa (Black),Great little speaker,4.0,Had a little trouble adding the device to my Amazon account but that's probably because my WiFi was acting up. The product itself is great. The sound is pretty loud for such a small thing. The Alexa integration works fine. No complaints so far.
Echo Dot (3rd Gen) – New and improved smart speaker with Alexa (Black),Just Superb!!!!,5.0,"It's a very nice product. I ordered it during the big billion day Sale. I got a wipro smart bulb free with it. The speaker sound is loud and clear. Don't go by its size, it produces sound loud enough to fill a small room. And the sound is very clear too. Alexa feature is also very helpful. I have bonded a smart bulb with it, which was very to easy to do. Just follow the instructions given in the instruction manual that comes with the product and all will be done without a hassle. Overall, a very nice product. Thank u Amazon."
Echo Dot (3rd Gen) – New and improved smart speaker with Alexa (Black),Alaxa Voice is Very Heart Full Voice A Man,5.0,"The media could not be loaded.
                



 Nice Products But Not Google Add in Google Add to Your Alexa Add to Google in All Information In Each Others Aap Information By the by Sach A Voice Smart Spaker  Very Nice Alaxa  Spaker 3ed Ganration Brand By Amazon Brand Amazing Voice Product Nice Buy it a 6 Days Very Beautiful Voice"
Echo Dot (3rd Gen) – New and improved smart speaker with Alexa (Black),Experience the Alexa as your own personal assistant,4.0,This is my first Alexa product. Got it for 1999 with a free 9 W Wipro smart bulb. At this price the combo was superb. IF you have weak wi fi connection then it will give some trouble otherwise go for it without a second doubt.
Echo Dot (3rd Gen) – New and improved smart speaker with Alexa (Black),Value for money,5.0,"The media could not be loaded.
                



 I have completely satisfied with the product and it's been nearly two months back i purchased it and I didn't found any drawbacks, Thanks."
Echo Dot (3rd Gen) – New and improved smart speaker with Alexa (Black),Must Buy Alexa,5.0,When You have alexa U never Ever feel alone as you can interact with Alexa And do tons of things like Listen to music.. news... weather forecast and many more... Alexa hindi Has so many good and very funny responses.. its kind of becomes your routine to talk to alexa... For sound quality i will say Its 4.5/5 star as the sound quality is amazing and can fill a room easily...
Echo Dot (3rd Gen) – New and improved smart speaker with Alexa (Black),It's ok n only ve better sound quality compared to Google mini,3.0,Most of the times it doesn't recognize what u meant.plus u need a subscription to use amazon music .thankfully I had apple music subscription
Echo Dot (3rd Gen) – New and improved smart speaker with Alexa (Black),Go for it!,4.0,So first looking at echo dot I thought it would be very small but the size is very good and sound is also very superb.Just the AI if you ask some questions it will not answer as crisp and clear which you get in Google otherwise for the entertainment this is the best and connectivity is also very easy.
Echo Dot (3rd Gen) – New and improved smart speaker with Alexa (Black),Alexa — our new found friend,5.0,Alexa becomes a family member even before you know it. The sound quality and ability to integrate with one’s daily life at home is awesome. From info on the weather to traffic snarls... we’ve come to depend on this bright new companion.
Echo Dot (3rd Gen) – New and improved smart speaker with Alexa (Black),Amazing,5.0,"The product is very good and compatible with almost anything.i ve connected my bedroom moodlighting wth alexa and i can turn on\off, change colors.And i can control many other devices and the audio quality i really good."
Echo Dot (3rd Gen) – New and improved smart speaker with Alexa (Black),Value for money,5.0,"Value for money, affordable virtual assistant. Crystal clear sound. Bass is good. Very responsive mic. Overall satisfied with the product from Amazon!"
Echo Dot (3rd Gen) – New and improved smart speaker with Alexa (Black),Very nice,5.0,Everything is good but the calling feature is asking to install the Alexa app on other phones too it's quite difficult for everyone so we couldn't able to make a call 🤷‍♀️
Echo Dot (3rd Gen) – New and improved smart speaker with Alexa (Black),Product is fine,3.0,"Being a prime member at Amazon is necessary, otherwise the product is unable to play music and popular songs. The sound quality is ok. Some instructions are hard for it to follow. Eg Alexa give us an applause."
Echo Dot (3rd Gen) – New and improved smart speaker with Alexa (Black),Can't control some smart bulb,3.0,It plays out nice music but it found it hard to connect smart bulbs.  I bought Halonix smart bulb. It recognized the bulb but can't control it.
Echo Dot (3rd Gen) – New and improved smart speaker with Alexa (Black),Very bad quality,1.0,1. Had to scream or stand very close to it then only it heard the command.2. It was playing 2 songs at the same time3. Sound quality was very poor
Echo Dot (3rd Gen) – New and improved smart speaker with Alexa (Black),Ok,5.0,मुझे इतना पसंद नहीं आई अलेक्सा मुझे उतना अच्छा नहीं लगा आप आप सिर्फ इस पर गाना सुन सकते हैं कुछ पूछ सकते हैं इसके अलावा और कुछ नहीं कर सकते
Echo Dot (3rd Gen) – New and improved smart speaker with Alexa (Black),Good product.,5.0,Good quality product.Good sound quality. Not compared with jbl or sony speakers but better than boat.Well it's not just a bluetooth speaker its smart.Alexa is very interactive it takes a bit time to update skills in alexa and then you can have alot of fun. It also has a aux output port you can connect any sound system for better sound.
Echo Dot (3rd Gen) – New and improved smart speaker with Alexa (Black),Must buy in a loot offer,4.0,Purchased in a loot offer for 1229.. Awesome for d price I paid.. Not worth if yo pay more than one thousand five hundred... My kid njoyyinh with it... Setup was very very easy..njoyyinh with free led bulb.. Sound quality is average..bt connectivity is good... Using it with mobile WiFi.. working well...
Echo Dot (3rd Gen) – New and improved smart speaker with Alexa (Black),Should be more cheaper c,1.0,Costliest than the quality . can we return it now?? as due to covid-19 Pandemic unable to process return of the device. all the packings are kept intact and even plastic over the product. kindly advice the procedure to return back now.
Echo Dot (3rd Gen) – New and improved smart speaker with Alexa (Black),"Disappointing ""smart"" speaker",2.0,Bought it in prime day salePros:Good sound quality considering sizeHas bluetoothHas aux outGood mics recognises whispers easily and whispers backCons:Too small in sizeNot value for moneyNot wirelessNot much smart functionNeeds good wifiHeats up
Echo Dot (3rd Gen) – New and improved smart speaker with Alexa (Black),"I think i made a mistake , should have gone for google mini",2.0,"I am totally bored , this device have crappy software and limited number of uses unlike its counterpart google mini. I made a terrible mistake buying it. I would love to return this if it weren't for the return period being over."
Echo Dot (3rd Gen) – New and improved smart speaker with Alexa (Black),Extremely poor speaker quality. Not worth at all.,1.0,Not worth at all. Overall extremely poor performance & after sales.
Echo Dot (3rd Gen) – New and improved smart speaker with Alexa (Black),No doubt it's an amazing product,5.0,It's a very good product but alexa must have some upgraded skills like voice lock and continuous conversation. I can't have continued covo with alexa and that's somewhat disappointing.
Echo Dot (3rd Gen) – New and improved smart speaker with Alexa (Black),Must buy,5.0,"I was so confused to buy it or not because there were many negative reviews but i decided to buy echo dot 3 gen, This is my first alexa device got delivered today just loving the sound and bass... Don't care of negative reviews just buy... Its awesome"
Echo Dot (3rd Gen) – New and improved smart speaker with Alexa (Black),A luxury toy unless you have a complete home automation setup.,4.0,"This is a really expensive bluetooth speaker that happens to take voice commands to play songs and switch on and off the one smart bulb in my room. That's for me, if you have a full home automation setup in your home, do buy it, it will be a good effective investment for the same."
Echo Dot (3rd Gen) – New and improved smart speaker with Alexa (Black),Not a Smart one its just a loud Speaker with Limited Voice command,2.0,"This not a smart speaker, most of time it will say ...""Sorry i don't know that"" or it will ask to refer amazon page for help.i will suggest Google smart speaker is much better alexa is just seems a scrap and more over alexa is just an amazon shopping tool to listen customers and suggesting them  products to buy."
Echo Dot (3rd Gen) – New and improved smart speaker with Alexa (Black),Alexa baby....,5.0,"Good experience,Good sound quality,u can also operate ur smart gadgets with this....when u asked funny question to Alexa in Hindi....She replied in a funny way,that was soo interesting about this product andAt night when u talk in wishper,she replied in the same way....that was soo cool....i lik this product.Must buy it..."
Echo Dot (3rd Gen) – New and improved smart speaker with Alexa (Black),Didn't connect properly with Android Devices.,1.0,Its always says invalid password while connecting to Android (Samsung) devices however its works on IOS devices. I have shared the screenshot with Amazon team but they barely reply. Highly disappointed
Echo Dot (3rd Gen) – New and improved smart speaker with Alexa (Black),No point in buying the dumb bluetooth speakers anymore,5.0,"Fabulous product with such an easy of operation that my aged mother uses it seamlessly. Easily recognizes hindi language. In the morning she just commands it to play live gurbani and later in the day her favourite singer's song.  No wires, no pairing with phones. Drop in feature is amazing too. It comes in handy at times when the phone is not nearby. All in all, an amazing product from amazon."
Echo Dot (3rd Gen) – New and improved smart speaker with Alexa (Black),Follow up mode not working,2.0,follow up mode not working.tried every troubleshooting.May be my product had some bug.returning it.follow up mode is most important feature in Alexa for using on tv or day to day questions.Not always respond to ur voice when u give continuous command one after anotherall other things were working fine.
Echo Dot (3rd Gen) – New and improved smart speaker with Alexa (Black),Device freezes after recognises the call word.,1.0,Device recognises the call work but then freezes. Does not execute commands given to it. Worst purchase ever.
Echo Dot (3rd Gen) – New and improved smart speaker with Alexa (Black),Worst experience,1.0,"It plays certain songs again and again, doesn't let you skip. Recognition has also gone from bad to worst, you have to yell for Alexa to understand what you want it to do only for it to tell you it doesn't understand what you said. And expect no support from Amazon about eco devices, it's very bad."
